QUERY_ID	HEADER	TITLE	MAIN_CONTENT	DATE	TAGSjb990mpskxt21u	Week 12/10 - 12/16	Arena Glitch!	Is there any problem with the arena design or is it fine? (This the the screenshot from the .pdf file. Team ID: #454) 	12-16-17	planter_bot
jb85r2vtta729o	Week 12/10 - 12/16	Photo Upload	By what name should we upload the photo of the arena! Is is not mentioned in the instructions! Shall we just uoload by our team name, or is there any specific format??	12-15-17	planter_bot
jb7wiaebl8k7c8	Week 12/10 - 12/16	about shipment of bot	we have not received shipment . when will we receive it . is there any way to track it. team id 1228	12-15-17	harvester_bot
jb7vqqayd3169t	Week 12/10 - 12/16	Planter_Bot	Hello All,  Please follow steps and video below to record opening your shipment received by you for the competition.  https://youtu.be/t5kH0YpsCiA  	12-15-17	planter_bot,Planter_Bot
jb7taq9h4pv5av	Week 12/10 - 12/16	please justify	#  team 2895the code we sent to guys was working fine but we got the comment that no output image only CSV.please check the content once more	12-15-17	harvester_bot
jb7p3268ff434n	Week 12/10 - 12/16	TASK 2 file name	sir, what should be the file name of task 2 Image file	12-15-17	transporter_bot
jb7ey550q3uh4	Week 12/10 - 12/16	Arena  printing	1.What should be the line thickness for the cell ??? 2. What should be the line thickness for the start and end point of the arena?	12-15-17	planter_bot
jb6pytw9j9d5k2	Week 12/10 - 12/16	Shipment details	Are we required to provide shipment detail ,if yes,then where we have to provide it? Please instruct..	12-14-17	planter_bot
jb6pv843bny2nb	Week 12/10 - 12/16	Regarding flex	Can the logos on the flex be in black and white, instead of red color?	12-14-17	planter_bot
jb6iokrlczv3bj	Week 12/10 - 12/16	shipment acknlodgement  pressed by mistake	we have by mistake pressed the acknlodgement button before we have received the components ...is there any problem ?????can u reset that???.team id 64	12-14-17	planter_bot
jb6i4ym9f2c1kx	Week 12/10 - 12/16	Can the  arena be printed on vinyl instead of flex sheets?	In accordance with the rules of Karnataka Government, the printing of flex sheets is banned in Bangalore. All the vendors we approached for the task, refused to print flex sheets. So, is it allowed to print the planter_bot arena on vinyl instead of flex? Thank you. Team ID #1541	12-14-17	planter_bot
jb6fbwtllxk2v0	Week 12/10 - 12/16	About printed flex sheet	Hello Sir/Madam, My Team ID is #2242,assigned to Planter Bot theme. I have a confusion regarding the printing of the arena! Do we have to print the small grids given in the track as well?? and if its true will the color be exactly same to the color for the LFR line, or slightly lighter intensity . The vendor wants a clear idea about this issue ! Thank youin advanced! 	12-14-17	planter_bot
jb6f6idmn6q18q	Week 12/10 - 12/16	Shipment	Can we revieve our shipment from the college directly? If yes then is there any way to know when will the shipment reach ,as our college is in vacations right now, and we might have to make a 12 hrs journey to go and collect the parcel! Kindly help us here!  Our Team ID is #2242	12-14-17	planter_bot
jb69fwh72is6uy	Week 12/10 - 12/16	Regarding shipment details	We were shortlisted to stage2. But we are not able to open a blog to fill shipment details. Please clarify regarding this ASAP	12-14-17	planter_bot
jb67ucz297x156	Week 12/10 - 12/16	Extention of time	Our exam will be continued till the next week..so if you kindly extend the time of submissions , we shall be ever greatfull .....	12-14-17	planter_bot
jb67jk2cut625x	Week 12/10 - 12/16	Shipment Details: Are not yet provided in our theme		12-14-17	transporter_bot
jb616be9n13t0	Week 12/10 - 12/16	Regarding remarks in task1 result.	We received the remark 'Improve accuracy and Resolve errors to complete your task' for task1 planterbot. While testing we received warning shown in the screen-shot but couldn't find a way to resolve it and ignored it as it did not affect the output. Was our marks cut because of these warnings? Or was there an error in task1A? Please elaborate as it will be helpful in later tasks. Please look into it. Team id #2243.   	12-14-17	harvester_bot,planter_bot,transporter_bot
jb5u1spe7vq73k	Week 12/10 - 12/16	To whom is the shipment addressed to?	Hello, we just wanted to know that whose name will the shipment bear, of the team leader or of the coordinator. Also, by when can we expect it, our college is in Delhi. I wanted to know this because I need to inform my college about the shipment and I will need to mention that who will it be addressed to and by whenwill it arrive.	12-14-17	harvester_bot,planter_bot,transporter_bot
jb5f1ni84pg2t7	Week 12/10 - 12/16	About Robot Shipment	How will we get the shipment details of the bot?	12-14-17	planter_bot
jb4gxy5khlt1fv	Week 12/10 - 12/16	Task 2 Deadline?	As on the portal, it is now shown Task 2 will be available from 14th December, 12:00 am. Then what would be the deadline for it? Is it 19th December? 	12-13-17	harvester_bot
jb3t6oxbrqn67q	Week 12/10 - 12/16	regarding result marks team #1591 marks awarded 35	  We completed the code as per the requirement and it was running fine & showing all the results.But as mentioned in Task1A description of planter bot theme, it is required to submit all the output image in .png format. It seems that the code gave an error in the program as the output image was already present in the same folder as code,csv file,and input image (also in .png format) & got read by the program which executed it and gave different values of color(255,255,255) resulting in code error. We think that as the code gave the error in execution all of our marks got deducted for task1A. Please refer to our code and execute it without the output image in the same folder and consider the code for marks evaluation for last time. Please consider our request one last time.  i run program with only test.png image present in the folder   	12-12-2017	planter_bot
jb2lgohsar33ar	Week 12/10 - 12/16	#4236 regarding task result	In the result .It says that in our solution of ps-3 code process only one request at a time ,But on our pc it process all the input at a time . here is the screen shot of console. there was three input file and processing all at a time, and saving the output to required file. team id:#4236	12-12-2017	transporter_bot
jb2izynpio04tz	Week 12/10 - 12/16	Question about results	Are we allowed to know about where our marks were detected ?? And what problems were present in our code, for future references?? 	12-11-2017	planter_bot
jb2ea9f7lnf1hp	Week 12/10 - 12/16	regarding penalty	Sir/Mam while submitting our video on the last submission date we requested for some extra time to upload the video as the internet connectivity was little bit slow , also we got the response that we have to submit the other files before 12 and we can submit our video after completing . Though we did the same and after a hour we uploaded the video but we have got penalty in out total mark . Please help us sir/mam	12-11-2017	transporter_bot
jb2a9oqgryrik	Week 12/10 - 12/16	Mistake in results	Team id 1604 We submitted the task 15 minutes before deadline but our score is 0.Our code was working (had some bugs) Our task 1A code was fully functional and task1B had some bugs but our score is 0.This is not possible. Also there were no remarks about our code.	12-11-2017	planter_bot
jb271matw4w39j	Week 12/10 - 12/16	Score related	Can we get to know..what error we have done. We got 82/100 ..	12-11-2017	planter_bot
jb24lf2iiv47ek	Week 12/10 - 12/16	Regarding task result	In the result .It says that in our solution of ps-3 code process only one request at a time , But on our pc it process all the input at a time .	12-11-2017	transporter_bot
jb2438bfzfxsn	Week 12/10 - 12/16	task 1 results	I had submitted both tasks of stage 1 properly but it's showing 0/100 . please help. what to do. we did whole task .	12-11-2017	planter_bot
jb23xsms75y1y2	Week 12/10 - 12/16	Task result	Sir on what basis the task is evaluated? Actually we have got the output from the code but the result shows the code was incorrect. #1060. 	12-11-2017	harvester_bot
jb227xizqdw6pt	Week 12/10 - 12/16	marks basis	On what basis the marks are given to the each team? We have successfully completed all the task with correct results for each test cases but we have not got full marks.	12-11-2017	planter_bot
jb21ykgqh9q5t7	Week 12/10 - 12/16	Remarks: Float div by zero error for undisclosed set of Task 1A.	Can you please tell why such an error could have occurred? Also on what basis have the scores been awarded	12-11-2017	harvester_bot
jb20hjmmdai4vf	Week 12/10 - 12/16	remarks given in task 1.	Throws errors for undisclosed set of images.can i get images on which program was giving error.when i tested program with random images it was showing correct results.please tell us how you test images so that we can make it friendly for testing .	12-11-2017	harvester_bot
jb1yal30f5j73l	Week 12/10 - 12/16	Remarks given as Task not Submitted.	Sir, we submitted our task on 30th November, with two days of penalty, but the remarks in the Task Result section is showing as Task not submitted and hence it shows that You are not shortlisted. Although the Task 1 section in E-yantra Portal has the zip file which can still be downloaded and which we had submitted and it shows We have received your submission.#3898 Our theme is Harvester Bot.	12-11-2017	harvester_bot,planter_bot,transporter_bot
jb1xzw5azm130f	Week 12/10 - 12/16	congratulations	congratulations to all the team,selected in stage 2,keep going and best of luck	12-11-2017	planter_bot
jb1utuhgqih4mv	Week 12/10 - 12/16	about feed back form	there is a question on the feed back form about team did not finish the task at we have to reply if we have done all our task completely?	12-11-2017	harvester_bot
javyjup5zpv3fz	Week 12/3 - 12/9	about task 2??	next task will be working with designing of hardware part or it is designing in computer using software	12-07-2017	planter_bot
jaufr3payku4gt	Week 12/3 - 12/9	task 2	is task2 simulation in computer or does it involve Workin with the hardware part	12-06-2017	planter_bot
jape1lu1uf65mi	Week 11/26 - 12/2	Small error	Mam actually, we accidentally specified cv2.RETR_EXTERNAL instead of TREE in the total contours section of task 1b video which we had not intended... It will work in normal conditions but won't work on a colored background due to this mistake..... Is there any way we can change it now ...Also, pls consider this change if you can. Will we get to know later what the unreleased videos and images were?? Our team id is #2415	12-02-2017	planter_bot
jaowawevbom1tr	Week 11/26 - 12/2	how can we detect the BGR content of a point whose coordinates are known to us.		12-02-2017	planter_bot
jamtay8gowunk	Week 11/26 - 12/2	Team-#1221....Sir/Mamm we have submitted our folder. There were some doubts.	"Team-#1221 Sir/mamm we submitted our task 1 folder. But in Task 1A we deleted one line by mistake which was to display the colour in the output image. Rest are displayed correctly . The csv file is as required containing the color as well. Only we deleted the line cv2.putText() for displaying color by mistake in the output image only. We were afraid that if we reupload now, we had to pay penalty for that. Should we leave it as it is or shall we reupload it?  There was another doubt. We used an algorithm of detecting four point objects (eg. Rhombus and trapezium) by comparing with existing templates of rhombus and trapezium. Rest objects are detected just by no. of points (sharp ends) of the objects. So for this we also uploaded a ""Templates"" folder containing the two images for comparison. This folder is there where the ""Task1(A/B)_main.py"" exists. I hope this doesn't create any problem. "	11-30-17	planter_bot,Planter_Bot
jalaqfw3lad2r6	Week 11/26 - 12/2	Image Processing Resources not available	"Hello!  The image processing DVD content in the resources section of the Eyantra Portal does not open and shows an error of ""Not Found"". Can I know how can I access those tutorials?  Thanks in advance"	11-29-17	planter_bot,Planter_Bot
jal42j8dziv24g	Week 11/26 - 12/2	Regarding submission	We have uploaded task 1 before the deadline but we have corrected some changes in the code.Now if we upload again which folder will be considered the one before deadline or the latest folder??	11-29-17	planter_bot
jakwi8lhmil55w	Week 11/26 - 12/2	Task 1B Doubt	Can we expect overlapping shapes such as concentric circles to appear as a testcase?	11-29-17	planter_bot
jakw2zsyd8j68x	Week 11/26 - 12/2	trouble in understanding params of VideoWriter	In VideoWriter(),when we give parameters as (outputpath,1,1,size) the video created displays one image less than it is intendeed,the problem doesnt appear for (outputpath,1,0.5,size) ?so how can i figure out what is the difference between both? Documentation shows the name of parameter as (outputpath,fourcc,fps,size) but doesnt tell (1=DIVX ,2=MJPg etc.)	11-29-17	planter_bot
jaksjfpci831lz	Week 11/26 - 12/2	Regarding selection	We have solved problem statement 1 and 3 . Created ,market place and farm but we have completed only 50% of game due to least time , but in gaming we used only python . Is there any chance for selection ?	11-29-17	transporter_bot
jakooxc8pc244b	Week 11/26 - 12/2	Task B	in the line :-return np.uint8(cv2.addWeighted(face_part, 255.0, overlay_part, 255.0, 0.0)) i get the following error :- error: (-209) The operation is neither 'array op array' (where arrays have the same size and the same number of channels), nor 'array op scalar', nor 'scalar op array' in function cv::arithm_op  i've made sure the height width and channel of the images is same . how do i rectify this error? please help.	11-29-17	planter_bot
jakm6ir3klp4rx	Week 11/26 - 12/2	this particular frame is causing the problem		11-29-17	planter_bot,Planter_Bot
jakls470mjf1t1	Week 11/26 - 12/2	Result of Task1	when result of task1 will be declared?	11-29-17	planter_bot
jakj5bfscg1k4	Week 11/26 - 12/2	Is this effect on marks??	We create a csv file for task_1B but the csv output is came in a row, Is this effect on marks? Please help.	11-29-17	planter_bot
jak1369kcoc141	Week 11/26 - 12/2	regarding file size	if my uploaded file size of zip file is less than 5mb, but main file is large.. ..is it ok? or we have to upload google drive link?	11-29-17	transporter_bot
jak0xrodsew4rd	Week 11/26 - 12/2	File Naming	In the description of task 1b it is mentioned that that the output video should be named as videooutput.mp4 while we had named the video as VideoOutput.mp4 . So will this cause any problem?	11-29-17	planter_bot
jajzrptsvc93nj	Week 11/26 - 12/2	problem in the updated video task 1b	after the triangle appear in the video,the trapezium and circle appear partially but its too fast (i guess this shouldn't happen). which is causing the problem and then at the end when the trapezium actually appears fully, i am unable to detect it becoz in my code the flags have already toggled due to its earlier partial appaerance .	11-29-17	planter_bot,Planter_Bot
jajytqsa6i4n7	Week 11/26 - 12/2	file is not getting uploaded	I have been trying to upload the file since 11:45pm but I am getting the following error.eYRC2017Track1_jajyt14r9ck.jpg	11-29-17	planter_bot
jajwkmh09f2s8	Week 11/26 - 12/2	Wrong Video. Part of trapezium is cut.	There is an issue with the updated video given to our team for task 1. The trapezium occurring in the video has it's part cut due to which there is an error in the video. The code is running successfully before this trapezium occurs in our video.  U can check it in the pictures attached. There is a picture attached regarding that cut out part of trapezium also.  Please help us as soon as possible. We'll be highly grateful for this very kind act.  Team id - 1029	11-28-17	planter_bot
jajw4oxkanl3vh	Week 11/26 - 12/2	Late submission	Can i submita day lateas our end semester exams are going on at present??? Is it allowed to submit late???	11-28-17	harvester_bot
jajw1iji4cg3th	Week 11/26 - 12/2	Task1B	I am unable to read the video frame using the command : ret, frame =cap.read() Return value of ret is supposed to be true but it's false. Could anyone help me fix this issue Related to task B.	11-28-17	planter_bot
jajvn8lcj2f1mb	Week 11/26 - 12/2	      What is the maximum size of the google form , in which we have to upload our task-1?	I have been trying to upload my task 1 folder from last 2-3 hrs, i have tried all ways to compress my folder but can't do it below 150 mb? What can I do now, Please help	11-28-17	transporter_bot
jajvcyus54f2dx	Week 11/26 - 12/2	cannot concatenate 'str' and 'int' objects	error comingcannot concatenate 'str' and 'int' objects when we use writecsv function	11-28-17	harvester_bot
jajuw0rc4bz3w8	Week 11/26 - 12/2	query about submission	hi ,do we need to edit the team I'd in code or we just need to rename the code i.e do we need to edit herefilep = open('results1A_teamid.csv','a')or we just need to rename .csv file	11-28-17	harvester_bot
jajt4l8pw944h7	Week 11/26 - 12/2			11-28-17	harvester_bot
jajswwvs3h55or	Week 11/26 - 12/2	task1b problem	how to add path to video i cant add path in def main(add path)	11-28-17	planter_bot
jajsszr72uy3ee	Week 11/26 - 12/2	task1A problem	if task1A_main.py automatically imports all png images how will i use cv2.imread(' something should be mentioned here') i cant't use cv2.imread() function and my code is not working exactly i am asking how i can read image into which variable?	11-28-17	planter_bot
jajsrxy54d22w3	Week 11/26 - 12/2	doubt about submission of task 1	1)whether the output file should contain only python code (which automatically generates .csv file and output images)and test images. or  2) it should contain output images and .csv file along with the code and test images????? please reply as soon as possible.	11-28-17	harvester_bot
jajs7ymo8a47e4	Week 11/26 - 12/2	.copy() function returns an error? Here frame is the img read from the video		11-28-17	planter_bot
jajq8c63tn7549	Week 11/26 - 12/2	Regarding acknowledgement of task 1 submission	After I uploaded my zip file, I got this on the screen: WhatsApp_Image_20171128_at_7.32.00_PM.jpeg  However, the eyantra website acknowledged only the video submission and not the zip file upload.  Is that how it works or do I have to upload my zip file again?  	11-28-17	transporter_bot
jajpvhzfi6z67j	Week 11/26 - 12/2	VIDEO STOPPED AFTER THIS	what should i do now	11-28-17	planter_bot,Planter_Bot
jajnvc94hhr690	Week 11/26 - 12/2	regarding main(fp)	why am i getting this error?	11-28-17	planter_bot
jajnssdiqr75f9	Week 11/26 - 12/2	regarding contents of csv	"In the first column of csv file of task 1A do we need to display the name of the Image or the path of the image?? By default it displays the path and if we want to display only the name of the image then we need to edit the ""DO NOT EDIT"" portion. What should we do?? (for displaying only image name----> ""filep.write(fp)"" has to be changed to ""filep.write(os.path.basename(fp))""  currently it is displaying--- C:/Downloads/Task 1/Task 1A/2. task_Description/Test Images\Test2.png, green-rhombus-815-361 But in the task it is written only to display--- ""Test2.png, green-rhombus-815-361"""	11-28-17	planter_bot
jajn7zz2eoh7kn	Week 11/26 - 12/2	regarding output	How to generate the CSV file of TASK 1A & TASK 1B	11-28-17	planter_bot
jajloc3ud1k2p2	Week 11/26 - 12/2	      Error when I pass the argument in blend_transparent, image passes with wrong dimensions	When I pass the image with this code: framegrab[x: x + w,y:y + h, :] = blend_transparent(img[x:x+w,y:y+h ,:], overlay_image) I get an error in the dimensions like this:  On interchanging x and y for img in the code: framegrab[x: x + w,y:y + h, :] = blend_transparent(img[y:y+h,x:x+w ,:], overlay_image) I get the interchanged dimensions and this error  Please help immediately as I am getting this error from a very long time	11-28-17	planter_bot,Planter_Bot
jajlbpcgldi68	Week 11/26 - 12/2	      Task 1b - error in , overlaying image for rhombus	i got the correct output for overlaying image for first four figures but for rhombus it produced an errorerror : operands could not broadcast together with shapes (232,176,3) (277,176,3)eYRC2017Track1_jajlaybfzm7.jpg	11-28-17	planter_bot
jajl2mla1ci3r3	Week 11/26 - 12/2	Regarding pixel values of BGR	What are the shades of blue green and red used ? Because [0,0,255] [0,255,0][255,0,0] for B,G and R respectively,did not work .	11-28-17	planter_bot
jajkkbia73c5zh	Week 11/26 - 12/2	Glitch in video	I am working on task 1B . I have downloaded the revised video. But there seems to be glitch in the video at 0:19. My overlay works fine up until that point. Is there another video which doesnt have this problem? 	11-28-17	planter_bot
jajigeu12go3j4	Week 11/26 - 12/2	related to problem statement 2	actually our texture is visible in blender render but they are not visible in blender game engine. so what we can do for that?	11-28-17	transporter_bot
jaji8okb5i22i7	Week 11/26 - 12/2	      Grayscale image of green, red and blue parts of the image return jagged lines. Why?	gray.png  So the flower first got overlaid on the hexagon properly, then the trapezoid appears and when I run grayscale on only green parts of the frame I get that jagged image. Why?	11-28-17	planter_bot
jajhlnuw4n223d	Week 11/26 - 12/2	cant't get output task 1A		11-28-17	planter_bot
jajgmoc8cpj2pv	Week 11/26 - 12/2	      When I am trying to overlay flowers on the video, how do I create a new frame...	...So that I can overlay the frames on so that I don't overwrite the original video? When I use .copy() like this: frame2=frame.copy() where frame is each frame of the video, I get an error. How do I fix this?	11-28-17	planter_bot
jaje890orar2o1	Week 11/26 - 12/2	uploading the task	Maa'm i uploaded the task with correct folder names. But when i download the submitted files , the name its showing is different from the name with which i submitted my folder!! Is that a problem???	11-28-17	planter_bot
jajds5cnphk2iv	Week 11/26 - 12/2	Overlay by  blend_transparent	How to call blend_transparent(face_img, overlay_t_img) function?	11-28-17	planter_bot
jajboatljya40s	Week 11/26 - 12/2	Issue with channel size	Ma'am.  The images provided to us are 3 channel images. Using a test program, we confirmed the number of channels as well. However, when we are using the 'addWeighted' function we are facing the following error: error: ..\..\..\..\opencv\modules\core\src\arithm.cpp:1287: error: (-209) The operation is neither 'array op array' (where arrays have the same size and the same number of channels), nor 'array op scalar', nor 'scalar op array' in function cv::arithm_op  Resizing the images in the same dimensions also did not help.  We have been provided Set 10 for the task.  Thanking you.	11-28-17	planter_bot
jaj8qw3yp3cx	Week 11/26 - 12/2	Error reading the video file	 While trying to read the video file this error occurs, even after providing the correct path. 	11-28-17	planter_bot,Planter_Bot
jaj89yl1dhemk	Week 11/26 - 12/2	what should be format for csv file for task 1b ?	writecsv adding extra , (comma) before the 1st line of output file (result1B_teamID.cvs) is it okay or i have to change writecsv function or should i write video name (video.mp4 ) before that comma ( column A )    	11-28-17	planter_bot,Planter_Bot
jaj853xxiyrlf	Week 11/26 - 12/2	Planter_Bot	do we have to write a different code for the comparison and printing of different quadilaterals like trapezium ,square and all , or we have to compare these quadilaterals with a square.png as done in the code provided by you? 	11-28-17	planter_bot,Planter_Bot
jaj5am7kce2368	Week 11/26 - 12/2	Problem in Video writing task 1b	While writing the video,the overlayed flower image does not remain stable and it keeps on flashing. How to remove this problem?? We have tried adjusting the cv2.waitKey() timings,but nothing helps out.	11-28-17	planter_bot
jaj4z6prt9ira	Week 11/26 - 12/2	Contours in task1b video	We have not considered the case that where one contour repeats after the 2 or 3 objects passed then as per the rules we have to overlay on the latest object(which was appeared earlier in the video and also have same centriod ,shape, size and color) Do we have to considerthis case or not?	11-28-17	planter_bot
jaj2l3ar8ae5og	Week 11/26 - 12/2	File Size	What is the maximum size of the file to be uploaded?	11-28-17	transporter_bot
jaj1fnu9kwe5sy	Week 11/26 - 12/2	Video error	In task 1B,the triangle which is in red colour in the video is detecting trapezium although I have tried Gaussian blur to remove the noise and other methods... It seems as there is some problem in contour detection or something .please resolve this problem	11-28-17	planter_bot
jaj1dhhadbw1xk	Week 11/26 - 12/2	Problem Statement 2	Can we use keys other than the keys mentioned(a,w....) to move our bot? Or the same key pressed should move the bot and simultaneously pick up the crate ??	11-28-17	transporter_bot
jaj15vrymrq796	Week 11/26 - 12/2	Submissiin	Do we need to change the path where we are submitting or simply we need to copy and paste where we have made changes..	11-28-17	planter_bot
jaj0cnm0jwm65p	Week 11/26 - 12/2	Task1b-def main(video_file_with_path)	def main(video_file_with_path) is giving error please tell me that what to write inside the main() in place of(video_file_with_path)	11-28-17	planter_bot
jaiyytmkcec16y	Week 11/26 - 12/2	problem statement 2	Where should we write comment regarding buttons used to move bot in game???	11-28-17	transporter_bot
jaiuv1uz5dg5lj	Week 11/26 - 12/2	      overlay video running very slow , how to do it correct???		11-28-17	planter_bot
